name,tagline,description,packCategory,priceBundle,priceOriginal,featured,stock,product1_name,product1_qty,product2_name,product2_qty,product3_name,product3_qty,product4_name,product4_qty,product5_name,product5_qty
Pack Prise de Masse,Le combo ultime pour prendre du volume,"Pack complet pour la prise de masse musculaire : gainer riche en calories, créatine pour la force et protéines pour la récupération.",masse,350,420,true,15,Real Mass - 6.8kg,1,Creatine Monohydrate - 500g,1,Isolate Pro - 2000g,1,,,,
Pack Sèche Extrême,Brûle les graisses et garde le muscle,"Combinaison optimale pour une sèche efficace : brûleur thermogénique, L-carnitine et protéines isolat pour préserver la masse musculaire.",seche,280,340,true,10,Lipo 6 Black Ultra Concentrate - 60 Capsules,1,L-Carnitine Green Tea + CLA - 90 Capsules,1,Isolate Pro - 2000g,1,,,,
Pack Débutant Musculation,Tout ce qu'il faut pour bien démarrer,"Pack idéal pour les débutants : protéines de qualité, créatine et multivitamines pour des résultats rapides et une santé optimale.",debutant,200,250,true,20,Isolate Pro - 2000g,1,Creatine Monohydrate - 500g,1,Multi Vitamins - 30 Capsules,1,,,,
Pack Force & Performance,Repousse tes limites,"Pack pre-workout + créatine + BCAA pour des séances intenses et une récupération accélérée.",performance,250,310,false,12,Behemoth Pre-Workout - 500g,1,Creatine Monohydrate - 500g,1,BCAA 2:1:1 Perform C - 300g,1,,,,
Pack Santé Homme,Vitalité et bien-être au quotidien,"Formule complète pour la santé masculine : boosters naturels, vitamines et oméga-3.",sante,180,230,false,10,Testobooster Gold Edition - 180 Capsules,1,Multi Vitamins - 30 Capsules,1,Fish Oil Omega-3 - 30 Capsules,1,,,,
