_id,name,brand,category,description,unit,quantity,servings,flavors,benefits,allergens,certifications,dosage,priceRetail,pricePurchase,priceWholesale,priceSlashed,stock,featured,metaTitle,metaDescription
product-eric-favre-creatine-pro-zero-300g,Creatine Pro Zero - 300g,Eric Favre,creatine,"Creatine Pro Zero - 300g de Eric Favre, cr├®atine pure pour augmenter la force, la puissance et les performances musculaires. Le suppl├®ment le plus ├®tudi├® scientifiquement.",gramme,300,100,,,"Aucun allerg├¿ne majeur intrins├¿que d├®clar├®. Z├®ro allerginiques contenus. Peut contenir traces atelier: soja, gluten (unlikely - fabrication cr├®atine pur minimaliste)",GMP|Vegan|Vegan Certifi├®,"PHASE CHARGEMENT (optionnel 5-7 jours): 12g/jour divis├® 4 doses 3g (matin, midi, apr├¿s-midi, soir) Avec glucose/carbs am├®liore absorption Suivi maintenance directe sans loading PHASE MAINTENANCE (8+ semaines): 3g/jour unique dose OU 1.",45,25,35,,100,false,Creatine Pro Zero - 300g | Eric Favre | Dodo Nutrition,Creatine Pro Zero - 300g de Eric Favre. Cr├®atine de qualit├® pour vos objectifs fitness. Livraison rapide partout en Tunisie.
product-applied-nutrition-critical-whey-advanced-protein-2000g,Critical Whey Advanced Protein - 2000g,Applied Nutrition,proteines,"Critical Whey Advanced Protein - 2000g de Applied Nutrition est une prot├®ine premium pour la croissance et la r├®cup├®ration musculaire. Formule riche en acides amin├®s essentiels, id├®ale apr├¿s l'entra├«nement.",kilogramme,2,61,Chocolate|Vanilla|Strawberry|Cookies & Cream,R├®cup├®ration 4-phas├®e absorption +28-35% efficacit├® vs dual-source whey standard|Synth├¿se prot├®ine mTOR immediate spike hydrolys├® <45min + sustained 2-3h concentr├® optimization|Croissance musculaire +18-22% BCAA 4.8g naturel ratio leucine-emphasized vs competitors|Anti-catabolisme nuit cas├®ine 5% 6-7h slow-release protection sommeil musculaire|Performance force BCAA oxidation fuel ketones brain clarity mental focus training|Immunit├® glutamine 4g GI barrier integrity permeabilit├® intestinale microbiome,"Contient: LAIT (grass-fed dairy), SOJA (l├®cithine) | Sans: Aspartame, Gluten",GMP|Halal|Informed Sport,1-2 doses quotidienne standard. Dose type post-workout imm├®diat 30g hydrolys├® spike + petit-d├®jeuner 30g matin. Intensit├® ├®lev├®e 2-3 doses: matin 30g + post-training 30-60g immediate recovery + pr├®-sommeil 30g avant coucher (cas├®ine slow-release nuit protection). Poids corporel 1.6-2.,260,145,205,,100,false,Critical Whey Advanced Protein - 2000g | Applied Nutrition,Critical Whey Advanced Protein - 2000g de Applied Nutrition. Prot├®ine de qualit├® pour vos objectifs fitness. Livraison rapide partout en Tunisie.
product-yava-labs-eaa-complex-300g,EAA Complex - 300g,Yava Labs,acides-amines,EAA Complex de Yava Labs fournit les acides amin├®s essentiels dont vos muscles ont besoin pour une r├®cup├®ration optimale et une croissance musculaire maximale.,gramme,300,34,Multiples: Green Apple|Cola|Orange (selon batch),Synth├¿se prot├®ine musculaire mTOR signalisation Leucine 4.6g dominant activation|R├®cup├®ration post-training acc├®l├®r├®e acides amin├®s 9 essentiels complets|Endurance ├®nergie musculaire Isoleucine Valine anti-fatigue soutien|Anti-catabolisme pr├®vention d├®gradation prot├®ine maigre BCAA protection|Performance athl├®tique am├®lioration force endurance acides amin├®s fuel|R├®cup├®ration inter-training support aminogramme continu,(acides amin├®s purs). Traces possibles: GLUTEN (atelier partag├® possible). .,,8.6g (1 scoop) dans 200ml eau par dose = 7.7g EAA. Anytime flexible timing. PR├ë-TRAINING: 8.6g 20-30min avant (├®nergie anticipation effort musculaire). INTRA-TRAINING: 8.6g m├®lange 400ml eau anytime pendant (├®nergie soutenue continuel). POST-WORKOUT: 8.,60,35,45,,100,false,EAA Complex - 300g | Yava Labs | Dodo Nutrition,EAA Complex - 300g de Yava Labs. Acides amin├®s de qualit├® pour vos objectifs fitness. Livraison rapide partout en Tunisie.
product-real-pharm-eaa-essential-amino-acids-420g,EAA Essential Amino Acids - 420g,Real Pharm,acides-amines,EAA Essential Amino Acids de Real Pharm fournit les acides amin├®s essentiels dont vos muscles ont besoin pour une r├®cup├®ration optimale et une croissance musculaire maximale.,gramme,420,35,Multiples (citron|orange|ananas|punch fruit|cerise|etc),Synth├¿se prot├®ines anabolisme activation mTOR construction|Anabolisme musculaire hypertrophie croissance optimale|R├®cup├®ration post-training acc├®l├®r├®e catabolisme pr├®vention|Performance endurance r├®sistance fatigue retard├®e|Immunit├® syst├¿me renforc├® threonine lysine support|Absorption ultra rapide 15-30min fen├¬tre anabolique,(acides amin├®s synth├®tiques purs). Traces possibles soja gluten atelier. Poudre instantan├®e aromatis├®e. Colorants tartrazine peut avoir effets activit├® . .,GMP|Sans OGM,1 dose 12g quotidien avant/pendant/apr├¿s training. Peut prendre 2 doses jours training intense (pr├® + post). Cure r├®guli├¿re training habituel,60,35,45,,100,false,EAA Essential Amino Acids - 420g | Real Pharm Tunisie,EAA Essential Amino Acids - 420g de Real Pharm. Acides amin├®s de qualit├® pour vos objectifs fitness. Livraison rapide partout en Tunisie.
product-scenit-nutrition-elite-arginine-120-capsules,Elite Arginine - 120 Capsules,Scenit Nutrition,acides-amines,"Elite Arginine - 120 Capsules de Scenit Nutrition, acides amin├®s essentiels pour la r├®cup├®ration musculaire et la r├®duction des courbatures. Soutient la synth├¿se prot├®ique et l'endurance.",capsule,120,30,,Vascularisation N.O stimulation vasodilatateur pump +30-50% afflux sanguin|Pump musculaire congestion esth├®tique extr├¬me look|Performance ├®nergie oxyde nitrique circulation am├®lior├®e|R├®cup├®ration N.O irrigation nutriments rapide inter-set|Endurance cardiovasculaire a├®robie VO2 augmentation|Circulation sanguine nitrique global sant├®,"G├®lule V├ëG├ëTALE compatible vegan. AUCUN allerg├¿ne majeur. SANS: gluten, soja, lait, arachides, crustac├®s | TRACES POSSIBLES: lait gluten soja oeufs crustac├®s atelier",GMP|HACCP,4 caps portion standard quotidienne. Pre-workout 4 caps eau 30-45min avant training timing optimal. Post-workout 4 caps optional recovery. Maximum 8 caps jour 2 doses flexible.,90,50,70,,100,false,Elite Arginine - 120 Capsules | Scenit Nutrition Tunisie,Elite Arginine - 120 Capsules de Scenit Nutrition. Acides amin├®s de qualit├® pour vos objectifs fitness. Livraison rapide partout en Tunisie.
product-impact-nutrition-extreme-pre-workout-230g,Extreme Pre Workout - 230g,Impact Nutrition,pre-workout,"Extreme Pre Workout - 230g de Impact Nutrition, booster pr├®-entra├«nement pour une ├®nergie explosive, un focus mental accru et une endurance prolong├®e pendant vos s├®ances.",gramme,230,15,Fruit Punch (Rouge)|Tropical|Autres variantes,├ënergie explosion caf├®ine 200mg hardcore +50-70% alertness|Endurance muscle fatigue repouss├®e beta-alanine carnosine|Pump vasculaire N.O citrulline arginine +30-50% congestion|Force explosive maximum anabolique intra-workout|Focus mental concentration taurine caf├®ine intensity|R├®cup├®ration glutamine 3g intra-workout anti-catabolism,"SANS: gluten, soja, lait, arachides, crustac├®s. .",,1 portion 15.4g standard. Prendre 30min avant training pr├®paration optimal. D├®buter 7.7g si tol├®rance caf├®ine test├®e puis augmenter 15.4g max. Ne pas d├®passer 15.4g/jour. Usage ├®pisodique ponctuel (2-3x semaine maximum).,50,30,40,,100,false,Extreme Pre Workout - 230g | Impact Nutrition Tunisie,Extreme Pre Workout - 230g de Impact Nutrition. Pre-workout de qualit├® pour vos objectifs fitness. Livraison rapide partout en Tunisie.
product-gsn-fish-oil-omega-3-30-capsules,Fish Oil Omega-3 - 30 Capsules,GSN,vitamines,Fish Oil Omega-3 de GSN fournit les acides amin├®s essentiels dont vos muscles ont besoin pour une r├®cup├®ration optimale et une croissance musculaire maximale.,g├®lule,30,30,,Sant├® cardiovasculaire c┼ôur fonction normale|Triglyc├®rides r├®duction cholest├®rol ├®quilibre|Fonction c├®r├®brale m├®moire concentration|Vision normale r├®tine protection DHA|Anti-inflammatoire articulations douleurs r├®duites|Pression art├®rielle r├®gulation naturelle,"CONTIENT: Poisson (huile extraite poissons gras), g├®latine poisson/bovine. Traces possibles: crustac├®s, soja (atelier).",GMP|ISO 9001,"1 g├®lule quotidien avec repas. Minimum 4-8 semaines r├®sultats, optimal 12-16 semaines cardiovasculaire longue dur├®e",30,15,25,,100,false,Fish Oil Omega-3 - 30 Capsules | GSN | Dodo Nutrition,Fish Oil Omega-3 - 30 Capsules de GSN. Vitamines et min├®raux de qualit├® pour vos objectifs fitness. Livraison rapide partout en Tunisie.
product-william-bonac-the-legend-series-gainer-legend-6-8kg,Gainer Legend - 6.8kg,William Bonac / The Legend Series,gainers,Gainer Legend 6.8kg de William Bonac / The Legend Series est le mass gainer parfait pour les pratiquants de musculation qui ont du mal ├á prendre du poids et de la masse musculaire.,kilogramme,6.8,90,Chocolate|Vanilla (standard),,"LAIT majeur (whey prot├®ine + cas├®ine micellaire). Peut contenir: soja, ┼ôuf, gluten, fruits ├á coque, crustac├®s (atelier partag├®)",GMP,Prise masse standard: 1 portion (75g) post-entra├«nement quotidien = +320 kcal Phase intensive: 2 portions (150g) quotidien post-entra├«nement + optionnel matin = +640 kcal Dur├®e: 8-12 semaines phase prise masse intensif continu,815,450,635,,100,false,Gainer Legend - 6.8kg | William Bonac / The Legend Series,Gainer Legend - 6.8kg de William Bonac / The Legend Series. Gainer prise de masse de qualit├® pour vos objectifs fitness. Livraison rapide partout en Tunisie.
product-real-pharm-glutamine-amino-acids-500g,Glutamine Amino Acids - 500g,Real Pharm,acides-amines,Glutamine Amino Acids de Real Pharm fournit les acides amin├®s essentiels dont vos muscles ont besoin pour une r├®cup├®ration optimale et une croissance musculaire maximale.,gramme,500,90,Citron|Orange|Fruits multiples (punch fruit|fraise|etc),R├®cup├®ration musculaire acc├®l├®r├®e post-training r├®g├®n├®ration|Synth├¿se prot├®ines optimisation anabolisme construction|Immunit├® syst├¿me renforc├®e 70% intestins d├®fenses|Catabolisme pr├®vention protection masse musculaire|Glycog├¿ne resynth├¿se stockage ├®nergie performance|Douleurs courbatures soreness DOMS r├®duction,(glutamine acide amin├® synth├®tique pur). Traces possibles soja gluten atelier. Poudre instantan├®e aromatis├®e. Colorants tartrazine peut avoir effets activit├® . .,GMP|Sans OGM,1-2 doses 5.5g quotidien (5-10g total). Post-workout imm├®diat + matin ├á jeun ou soir avant coucher. Cure r├®guli├¿re training habituel,75,40,60,,100,false,Glutamine Amino Acids - 500g | Real Pharm | Dodo Nutrition,Glutamine Amino Acids - 500g de Real Pharm. Acides amin├®s de qualit├® pour vos objectifs fitness. Livraison rapide partout en Tunisie.
product-miravella-guarana-22-guaranine-90-capsules,Guarana (22% Guaranine) - 90 Capsules,Miravella,boosters,Guarana (22% Guaranine) de Miravella est le br├╗leur de graisse efficace pour acc├®l├®rer votre perte de poids et r├®v├®ler vos muscles.,g├®lule,90,30,,Thermogen├¿se combustion graisses m├®tabolisme acc├®l├®r├®e|├ënergie stable prolong├®e 4-6h sans crash|Performance endurance musculaire r├®sistance|Focus concentration vigilance mentale|Antioxydants tanins polyph├®nols cellulaire|M├®tabolisme lipidique stimulation,"G├®latine bovine Halal. Caf├®ine traverse placentaire. D├®conseill├® femmes enceintes/allaitantes, enfants < 12 ans, hypertension troubles cardiaques (consultation), insomnie sommeil (prendre matin).",GMP|Halal,"1-3 g├®lules quotidien matin. Cure 4-8 semaines r├®sultats, toute ann├®e r├®guli├¿re possible",65,35,50,,100,false,Guarana (22% Guaranine) - 90 Capsules | Miravella Tunisie,Guarana (22% Guaranine) - 90 Capsules de Miravella. Booster hormonal de qualit├® pour vos objectifs fitness. Livraison rapide partout en Tunisie.
product-gym-hub-gym-hub-shaker-500g,Gym Hub Shaker - 500g,Gym Hub,accessoires,"Gym Hub Shaker - 500g de Gym Hub, accessoire de qualit├® pour accompagner vos entra├«nements. Con├ºu pour la durabilit├® et le confort.",millilitre,500,,Couleurs vari├®es (noir|blanc|transparent),Pr├®paration optimale suppl├®ments poudres dissolution parfaite|Tamis int├®gr├® boule m├®lange grumeaux ├®limination texture lisse|Couvercle herm├®tique ├®tanche anti-fuite transport s├®curis├®|Capacit├® 500ml graduations mesure pr├®cise dosage|Plastique ABS BPA-free alimentaire s├®curis├® sant├®|R├®utilisable durable ├®cologique vs bouteilles jetables,Aucun (accessoire plastique alimentaire). CONTIENT: Plastique ABS BPA-free. Lavage eau savon temp├®rature ambiante (pas lave-vaisselle chaleur excessive d├®formation). S├®chage air libre.,,"Accessoire r├®utilisable illimit├®. Dosage selon suppl├®ment utilis├® (whey 30g, BCAA 5-10g, pr├®-workout 10-20g, etc)",20,10,15,,100,false,Gym Hub Shaker - 500g | Gym Hub | Dodo Nutrition,"Gym Hub Shaker - 500g de Gym Hub, accessoire de qualit├® pour accompagner vos entra├«nements. Livraison rapide en Tunisie."
product-scenit-nutrition-hmb-3000-vitamine-b6-120-capsules,HMB 3000 + Vitamine B6 - 120 Capsules,Scenit Nutrition,vitamines,HMB 3000 + Vitamine B6 de Scenit Nutrition fournit les acides amin├®s essentiels dont vos muscles ont besoin pour une r├®cup├®ration optimale et une croissance musculaire maximale.,g├®lule,120,20,,Anti-catabolisme r├®duction d├®gradation prot├®ine musculaire (HMB signalisation mTOR)|Augmentation synth├¿se prot├®ine musculaire nette positive balance|Pr├®vention fonte muscle durant d├®ficit calorique/r├®gime/inactivit├®|Acc├®l├®ration r├®cup├®ration post-training fatigue musculaire r├®duite|Support immunitaire L-Glutamine fonction immune|R├®duction cr├®atine kinase marqueurs dommages musculaires,"TRACES POSSIBLES: LAIT, GLUTEN, SOJA, ┼ÆUFS, CRUSTAC├ëS (atelier). .",GMP|ISO 9001,6 g├®lules/jour dose standard = 3000mg HMB (classique clinique). Maximum 12 g├®lules/jour = 6000mg HMB intensif (rare tol├®rance ├®tablie). Minimum 3 g├®lules/jour = 1500mg maintenance l├®g├¿re (moins efficace).,55,30,45,,100,false,HMB 3000 + Vitamine B6 - 120 Capsules | Scenit Nutrition,HMB 3000 + Vitamine B6 - 120 Capsules de Scenit Nutrition. Vitamines et min├®raux de qualit├® pour vos objectifs fitness. Livraison rapide partout en Tunisie.
product-impact-nutrition-hurricane-mass-gainer-3000g,Hurricane Mass Gainer - 3000g,Impact Nutrition,gainers,Hurricane Mass Gainer 3kg de Impact Nutrition est le mass gainer parfait pour les pratiquants de musculation qui ont du mal ├á prendre du poids et de la masse musculaire.,kilogramme,3,22,Chocolat|Vanille|Banane (ar├┤mes naturels),Prise masse explosive ratio 6:1 +30-50% gains 8-12 semaines|Surplus calorique 600 kcal/portion d├®ficit prevention|Carbs maltodextrine 200g rapid energy ATP restoration|Prot├®ines 40g complet aminoacide synth├¿se maximal|R├®cup├®ration intra-workout post-training combined|Lipides essentiels 12g cofacteur hormonal testosterone,"Contient LAIT SOJa (pea protein). SANS: gluten, arachides, crustac├®s | TRACES: gluten soja atelier",GMP,1-2 portions quotidienne standard. Post-training 135g (1 portion) immediate recovery. Alternative 2 portions mid-day surplus calorique. Recommand├® max 3 portions jour si intensive training multiple sessions.,360,200,280,,100,false,Hurricane Mass Gainer - 3000g | Impact Nutrition Tunisie,Hurricane Mass Gainer - 3000g de Impact Nutrition. Gainer prise de masse de qualit├® pour vos objectifs fitness. Livraison rapide partout en Tunisie.
product-impact-nutrition-hurricane-mass-gainer-7000g,Hurricane Mass Gainer - 7000g,Impact Nutrition,gainers,Hurricane Mass Gainer 7kg de Impact Nutrition est le mass gainer parfait pour les pratiquants de musculation qui ont du mal ├á prendre du poids et de la masse musculaire.,kilogramme,7,51,Chocolate|Vanille|Fraise|Tropical,Prise masse ULTRA-EXPLOSIVE ratio 6:1 +50-80% gains hardcore|Surplus calorique 600-650 kcal EXTR├èME maximisation|Carbs 200g maltodextrine ultra-rapides ATP|Prot├®ines 40g WheyPea synergy complet|Dextrose 40g glucose immediate|Lipides 12g essentiels hormonal,"Contient LAIT (whey) SOJa (pea). SANS: gluten, arachides, crustac├®s | TRACES: gluten soja atelier",GMP,135g portion quotidienne minimum. Post-training 135g immediate. Intensif 2-3 portions 270-405g/jour mega-bulk. Maximum 405g jour training extreme multiple.,840,460,655,,100,false,Hurricane Mass Gainer - 7000g | Impact Nutrition Tunisie,Hurricane Mass Gainer - 7000g de Impact Nutrition. Gainer prise de masse de qualit├® pour vos objectifs fitness. Livraison rapide partout en Tunisie.
product-impact-nutrition-hydro-eaa-zero-300g,Hydro EAA Zero - 300g,Impact Nutrition,acides-amines,Hydro EAA Zero 300g de Impact Nutrition fournit les acides amin├®s essentiels dont vos muscles ont besoin pour une r├®cup├®ration optimale et une croissance musculaire maximale.,gramme,300,20,Tropical|Fraise|Raisin|Citron (ar├┤mes naturels),Synth├¿se prot├®ine maximale EAA complet mTOR stimulation|Recovery acc├®l├®r├®e hydrolys├® absorption <30min rapide|Anti-catabolisme prevention intra-workout sipping|Performance ├®nerg├®tique EAA fuel amino-acid direct|Absorption ultra-rapide hydrolys├® peptides peptide bonds rompus|Zero-sucre composition diabete friendly,"SANS: gluten, soja, lait, arachides, crustac├®s. Compatible vegan vegetarien.",GMP,"10-15g portion standard. Intra-workout 10g sipping during training, post-workout 10-15g immediate recovery. Max 30g/jour.",60,35,45,,100,false,Hydro EAA Zero - 300g | Impact Nutrition | Dodo Nutrition,Hydro EAA Zero - 300g de Impact Nutrition. Acides amin├®s de qualit├® pour vos objectifs fitness. Livraison rapide partout en Tunisie.
product-applied-nutrition-iso-xp-1-8kg,ISO XP - 1.8kg,Applied Nutrition,proteines,"ISO XP - 1.8kg de Applied Nutrition est une prot├®ine premium pour la croissance et la r├®cup├®ration musculaire. Formule riche en acides amin├®s essentiels, id├®ale apr├¿s l'entra├«nement.",kilogramme,1.8,72,Vanilla|Chocolate|Strawberry|Cookies & Cream,,"ALLERG├êNE MAJEUR: LAIT - Whey protein isolate d├®riv├® lait vache. Peut contenir traces: Soja (l├®cithine tournesol alternative soja possible), ┼ôuf, gluten, crustac├®s (atelier partag├®)",GMP|ISO 22000|Halal|Halal Certifi├®|Informed Sport,Phase s├¿che/d├®finition: 25-50g quotidien (1-2 portions = 23-46g prot├®ine) Phase maintenance: 25g post-entra├«nement (1 portion) Usage quotidien flexible: 1-3 portions 25g r├®parties selon objectifs/hydratation/app├®tit Dur├®e: utilisation continue 12+ mois suppl├®mentation prot├®ine quotidienne,235,130,185,,100,false,ISO XP - 1.8kg | Applied Nutrition | Dodo Nutrition,ISO XP - 1.8kg de Applied Nutrition est une prot├®ine premium pour la croissance et la r├®cup├®ration musculaire. Livraison rapide en Tunisie.
product-longevity-plus-immuno-boost-60-capsules,Immuno-Boost - 60 Capsules,Longevity Plus,vitamines,"Immuno-Boost - 60 Capsules de Longevity Plus pour soutenir votre sant├® globale, votre immunit├® et vos performances sportives. Formule compl├¿te en vitamines et min├®raux essentiels.",capsule,60,30,,,"G├®latine bovine. Peut contenir lait (lanoline sheep), gluten, soja (atelier partag├®)",GMP,Standard: 2 caps quotidien (1 dose D3+C),40,20,30,,100,false,Immuno-Boost - 60 Capsules | Longevity Plus | Dodo Nutrition,Immuno-Boost - 60 Capsules de Longevity Plus. Vitamines et min├®raux de qualit├® pour vos objectifs fitness. Livraison rapide partout en Tunisie.
product-scenit-nutrition-instant-real-mass-2-72kg,Instant Real Mass - 2.72kg,Scenit Nutrition,gainers,Instant Real Mass 2.72kg de Scenit Nutrition est le mass gainer parfait pour les pratiquants de musculation qui ont du mal ├á prendre du poids et de la masse musculaire.,kilogramme,2.72,45,Chocolat|Vanille|Fraise,,"Allerg├¿nes principaux: Lait, gluten, soja. Traces potentielles: ┼ôufs, crustac├®s",GMP|ISO 9001,Phase de prise de masse: 60g (1 mesure) trois fois par jour dans 350ml d'eau ou lait Phase de repos: 30g le matin et 15g l'apr├¿s-midi Dosage maximum: 120g par jour pour les utilisateurs avanc├®s,325,180,255,,100,false,Instant Real Mass - 2.72kg | Scenit Nutrition Tunisie,Instant Real Mass - 2.72kg de Scenit Nutrition. Gainer prise de masse de qualit├® pour vos objectifs fitness. Livraison rapide partout en Tunisie.
product-scenit-nutrition-instant-real-mass-7kg,Instant Real Mass - 7kg,Scenit Nutrition,gainers,Instant Real Mass de Scenit Nutrition est le mass gainer parfait pour les pratiquants de musculation qui ont du mal ├á prendre du poids et de la masse musculaire.,kilogramme,7,38,Chocolat|Vanille|Fraise (Strawberry),"Apport calorique ├®lev├® (650 kcal/dose) pour prise de masse rapide|Double source prot├®ines (whey + isolat) pour croissance musculaire optimale|Cr├®atine 5% pour force, endurance et explosivit├®|Taurine 5% pour retarder la fatigue|BCAA (leucine, isoleucine, valine) anti-catabolisme|Enrichi vitamines et min├®raux pour performances sportives","Contient: GLUTEN (avoine), LAIT, SOJA (l├®cithine). Traces possibles: ┼ôufs, poisson, crustac├®s, sulfites",GMP|HACCP,"OPTION 1 (Site officiel): 60g (1 dosette) dans 350ml eau/lait, 3x/jour = 180g/jour total OPTION 2 (Distributeurs TN): - Jours d'entra├«nement: 60g ├á 10h + 60g 1h avant effort = 120g/jour - Jours de repos: 30g ├á 10h + 30g ├á 15h = 60g/jour",840,460,655,,100,false,Instant Real Mass - 7kg | Scenit Nutrition | Dodo Nutrition,Instant Real Mass - 7kg de Scenit Nutrition. Gainer prise de masse de qualit├® pour vos objectifs fitness. Livraison rapide partout en Tunisie.
product-nutrex-isofit-isolate-2270g,Isofit Isolate - 2270g,Nutrex,proteines,"Isofit Isolate - 2270g de Nutrex est une prot├®ine premium pour la croissance et la r├®cup├®ration musculaire. Formule riche en acides amin├®s essentiels, id├®ale apr├¿s l'entra├«nement.",kilogramme,2.27,76,Cookies & Cream|Chocolat|Vanille|Fraise,Croissance musculaire +25-30% isolat BCAA 5.5g fen├¬tre post-workout optimale ├®tude|Absorption ultra-rapide 25g isolat CFM microfiltration 30-60min max|D├®finition musculaire ultra-nette 115 kcal minimal adiposit├® phase s├¿che|Force puissance BCAA 5.5g ratio leucine-emphasized mTOR activation|R├®cup├®ration MCT Oil ketones ├®nergie ATP resynthesis post-training|Sant├® intestinale inuline pr├®biotique fiber microbiome dysbiosis prevention,"Contient: LAIT, SOJA (lecithin) | SANS: gluten, arachides, crustac├®s, aspartame |",GMP,1-2 portions quotidienne standard. Post-workout 30g immediate 15-30min apr├¿s training fen├¬tre anabolique. Petit-d├®jeuner optionnel 30g matin protein boost. Poids corporel 1.6-2g prot├®ines/kg poids exemple 80kg = 128-176g/jour 4-6 portions combined alimentaire + supplement.,385,210,300,,100,false,Isofit Isolate - 2270g | Nutrex | Dodo Nutrition,Isofit Isolate - 2270g de Nutrex est une prot├®ine premium pour la croissance et la r├®cup├®ration musculaire. Livraison rapide en Tunisie.
product-gsn-isolate-pro-2000g,Isolate Pro - 2000g,GSN,proteines,"Isolate Pro - 2000g de GSN est une prot├®ine premium pour la croissance et la r├®cup├®ration musculaire. Formule riche en acides amin├®s essentiels, id├®ale apr├¿s l'entra├«nement.",kilogramme,2,67,Vanille|Chocolat|Fraise|Cookies & Cream,Croissance musculaire (+15-20% synth├¿se prot├®ique vs concentr├® ├®tude IJSPP)|R├®cup├®ration acc├®l├®r├®e (-40% courbatures jour+1 BCAA L-Leucine)|D├®finition musculaire ultra-nette adiposit├® minimale 113cal|Assimilation rapide 60-90min window post-workout optimal|Sati├®t├® prot├®ique r├®duction app├®tit 27g/dose|Performance force sans fatigue BCAA anti-catabolisme,"Contient: Lait, Soja (l├®cithine) | Sans: Gluten",GMP|GMP Certified|Informed Choice|GMO Free,1-3 doses quotidiennes. Dose standard 1x par jour post-workout imm├®diat 30g poudre. Intensit├® ├®lev├®e 2-3 doses: dose petit-d├®jeuner 30g + post-workout 30g + soir├®e optionnel 30g avant sommeil (prot├®ines lentes cas├®ine pr├®f├®r├®e nuit).,340,185,265,,100,true,Isolate Pro - 2000g | GSN | Dodo Nutrition,Isolate Pro - 2000g de GSN est une prot├®ine premium pour la croissance et la r├®cup├®ration musculaire. Livraison rapide en Tunisie.
