_id,name,brand,category,description,unit,quantity,servings,flavors,benefits,allergens,certifications,dosage,priceRetail,pricePurchase,priceWholesale,priceSlashed,stock,featured,metaTitle,metaDescription
product-longevity-plus-neuro-plus-30-capsules,Neuro Plus - 30 Capsules,Longevity Plus,vitamines,"Neuro Plus - 30 Capsules de Longevity Plus pour soutenir votre sant├® globale, votre immunit├® et vos performances sportives. Formule compl├¿te en vitamines et min├®raux essentiels.",g├®lule,30,30,,D├®tente musculaire crampes reduction tension soulagement magn├®sium cofacteur|├ëquilibre nerveux stress management cortisol regulation magn├®sium modulation|Am├®lioration sommeil qualit├® magn├®sium d├®tente B6 m├®latonine support|R├®duction fatigue mental physical magn├®sium ATP energy cofacteur|Synth├¿se neurotransmetteur B6 serotonin dopamine mood stability|Migraine prevention magn├®sium neuronal stabilisation tension r├®duction,"G├®latine V├ëG├ëTALE vegan-friendly compatible. AUCUN allerg├¿ne majeur. SANS: gluten, soja, lait, arachides, crustac├®s, ┼ôufs, sucre. Consultable: femmes enceintes/allaitantes donn├®es suffisantes.",GMP,"1-2 g├®lules quotidienne flexible. Dose standard 1 g├®lule soir avant coucher (optimal magn├®sium sommeil support). Alternative: 2 g├®lules soir├®e ou 1 g├®lule matin 1 soir r├®gularit├® sym├®trique. Cure minimum 4 semaines r├®sultats premiers visibles, optimal 8-12 semaines.",30,15,25,,100,false,Neuro Plus - 30 Capsules | Longevity Plus | Dodo Nutrition,Neuro Plus - 30 Capsules de Longevity Plus. Vitamines et min├®raux de qualit├® pour vos objectifs fitness. Livraison rapide partout en Tunisie.
product-gsn-nitro-whey-2kg,Nitro Whey - 2kg,GSN,proteines,"Nitro Whey - 2kg de GSN est une prot├®ine premium pour la croissance et la r├®cup├®ration musculaire. Formule riche en acides amin├®s essentiels, id├®ale apr├¿s l'entra├«nement.",kilogramme,2,67,Multiples: Chocolat|Fraise|Vanille (selon batch),Synth├¿se prot├®ine musculaire 22g dense dose optimal BCAA naturels whey|Recovery post-training acceler├®e absorption rapide PDCAAS 0.99|Cr├®atine 2g force explosive endurance ATP production|Croissance musculaire maigre lean gains definition propre|Densit├® nutritionnel 22g prot├®ine / 120 kcal ultra-efficace|Absorption rapide PDCAAS 0.99 utilisation prot├®ine maximale,"CONTIENT: LAIT (whey prot├®ines), SOJA (l├®cithine). Traces: GLUTEN, ┼ÆUFS, FRUITS ├Ç COQUE, GRAINES S├ëSAME, C├ëLERI, SULFITES (atelier). .",GMP,30g (1 scoop) dans 250ml eau/lait par dose = 22g prot├®ine + 2g cr├®atine. Anytime flexible moment prise. Maximum 60g (2 scoops)/jour = 44g prot├®ine (tol├®rance ├®tablie). Cure continue journali├¿re optimal sans interruption (prot├®ine s├╗re chronique).,260,145,205,,100,false,Nitro Whey - 2kg | GSN | Dodo Nutrition,Nitro Whey - 2kg de GSN est une prot├®ine premium pour la croissance et la r├®cup├®ration musculaire. Livraison rapide en Tunisie.
product-miravella-nopal-120-capsules,Nopal - 120 Capsules,Miravella,bruleurs,Nopal - 120 Capsules de Miravella est un br├╗leur de graisse qui acc├®l├¿re le m├®tabolisme et favorise la perte de poids. Formule thermog├®nique pour une s├¿che efficace.,g├®lule,120,20,,Coupe-faim naturel sati├®t├® rapide app├®tit contr├┤le|Perte poids minceur r├®gime amaigrissant soutien|Digestion facilitation transit intestinal r├®gularit├®|Glyc├®mie cholest├®rol r├®gulation ├®quilibre m├®tabolique|Fibres mucilages effet ├®ponge volume estomac|Troubles digestifs ulc├¿res reflux gastriques pr├®vention,"(nopal cactus naturel). CONTIENT: G├®latine bovine Halal. D├®conseill├® femmes enceintes/allaitantes sans avis m├®dical, enfants jeunes (adaptation dosage). .",GMP|Halal|Halal Certifi├®,"4-6 g├®lules quotidien (2 g├®lules avant 2 principaux repas). Minimum 4 semaines r├®sultats, optimal 8-12 semaines minceur",95,50,75,,100,false,Nopal - 120 Capsules | Miravella | Dodo Nutrition,Nopal - 120 Capsules de Miravella est un br├╗leur de graisse qui acc├®l├¿re le m├®tabolisme et favorise la perte de poids. Livraison rapide en Tunisie.
product-yava-labs-omega-3-90-capsules,Omega 3 - 90 Capsules,Yava Labs,vitamines,"Omega 3 - 90 Capsules de Yava Labs pour soutenir votre sant├® globale, votre immunit├® et vos performances sportives. Formule compl├¿te en vitamines et min├®raux essentiels.",capsule,90,90,,Cardiovasculaire triglyc├®ride regulation tension art├®rielle control coeur sant├®|Cerveau fonction cognitive performance mentale m├®moire|Vision r├®tinienne acuit├® prot├®g├®e support oculaire|Anti-inflammatoire r├®duction inflammation chronique syst├®mique|D├®pression anxi├®t├® reduction EPA propri├®t├® mood support|Articulations inflammatoire reduction mobilit├® amelioration,CONTIENT: POISSON (Anchois source huile). Traces possibles: GLUTEN (atelier partag├®). .,,"1 capsule/jour dose standard (1000mg huile poisson, 180mg EPA, 120mg DHA). Anytime flexible moment prise. Maximum 2 capsules/jour = 2000mg (tol├®rance ├®tablie bien ├®tudi├®). Minimum 1 capsule/jour (dosage efficace minimum ├®tudi├®).",45,25,35,,100,false,Omega 3 - 90 Capsules | Yava Labs | Dodo Nutrition,"Omega 3 - 90 Capsules de Yava Labs pour soutenir votre sant├® globale, votre immunit├® et vos performances sportives. Livraison rapide en Tunisie."
product-miravella-omega-3-epax-90-capsules,Omega 3 - Epax┬« - 90 Capsules,Miravella,vitamines,Omega 3 - Epax┬« de Miravella fournit les acides amin├®s essentiels dont vos muscles ont besoin pour une r├®cup├®ration optimale et une croissance musculaire maximale.,g├®lule,90,45,,Sant├® cardiovasculaire c┼ôur r├®duction inflammations pression r├®gulation|Fonctions c├®r├®brales m├®moire concentration cognitive sant├®|Sant├® oculaire vision protection d├®g├®n├®rescence maculaire|Anti-inflammatoire douleurs articulaires chroniques soulagement|Syst├¿me immunitaire renforc├® d├®fenses optimales|Absorption optimis├®e extraction froid purification rigoureuse,"CONTIENT: Poisson (huile extraite poissons gras sauvages), g├®latine poisson. Traces possibles: crustac├®s, soja (atelier). D├®conseill├®: personnes allergiques poissons, hypotension troubles coagulation (consultation m├®decin), femmes enceintes/allaitantes (consultation m├®decin prudence)",GMP,"1-2 g├®lules quotidien avec repas midi. Cure 3 mois r├®sultats optimaux, r├®p├®table plusieurs fois/an",45,25,35,,100,false,Omega 3 - Epax┬« - 90 Capsules | Miravella | Dodo Nutrition,Omega 3 - Epax┬« - 90 Capsules de Miravella. Vitamines et min├®raux de qualit├® pour vos objectifs fitness. Livraison rapide partout en Tunisie.
product-real-pharm-omega-3-6-9-1370-capsules,Omega 3.6.9 - 1370 Capsules,Real Pharm,vitamines,"Omega 3.6.9 - 1370 Capsules de Real Pharm pour soutenir votre sant├® globale, votre immunit├® et vos performances sportives. Formule compl├¿te en vitamines et min├®raux essentiels.",capsule,1370,90,,,"ALLERG├êNE PRINCIPAL: Poisson (huile de poisson). Peut contenir traces de: soja, ┼ôuf, crustac├®s, gluten",GMP|EFSA,Dose standard: 1 capsule par jour (90 capsules = 90 jours approvisionnement) Dose optimale pour sportifs: 1-2 capsules par jour (matin) Dose pour pr├®vention sant├®: 1 capsule quotidienne minimum Pas de limite maximale scientifiquement prouv├®e (s├╗r jusqu'├á 3g/jour om├®ga-3),70,40,55,,100,false,Omega 3.6.9 - 1370 Capsules | Real Pharm | Dodo Nutrition,Omega 3.6.9 - 1370 Capsules de Real Pharm. Vitamines et min├®raux de qualit├® pour vos objectifs fitness. Livraison rapide partout en Tunisie.
product-rule-1-pre-amino-energy-252g,Pre Amino Energy - 252g,Rule 1,pre-workout,Pre Amino Energy 252g de Rule 1 fournit les acides amin├®s essentiels dont vos muscles ont besoin pour une r├®cup├®ration optimale et une croissance musculaire maximale.,gramme,252,30,Tropical|Frozen Bombsicle|Grapefruit,Matin|Apr├¿s-midi,"Aucun allerg├¿ne majeur intrins├¿que d├®clar├®. Peut contenir: soja (atelier partag├® Rule1), gluten (traces fabrication atelier), aucun lait/oeufs/arachides d├®clar├®s",GMP|GMP Certified,Pr├®-entra├«nement: 1 scoop (8.4g) 15-20 min avant effort optimal Alternative matin: 1 scoop remplacement caf├® petit-d├®jeuner Apr├¿s-midi boost: 1 scoop 15h energy sans crash Double dose HIIT: 2 scoops (16.8g) pr├®-cardio intensif Fr├®quence: 1-2 doses quotidien flexible,50,30,40,,100,false,Pre Amino Energy - 252g | Rule 1 | Dodo Nutrition,Pre Amino Energy - 252g de Rule 1. Pre-workout de qualit├® pour vos objectifs fitness. Livraison rapide partout en Tunisie.
product-impact-nutrition-premium-whey-1800g,Premium Whey - 1800g,Impact Nutrition,proteines,"Premium Whey - 1800g de Impact Nutrition est une prot├®ine premium pour la croissance et la r├®cup├®ration musculaire. Formule riche en acides amin├®s essentiels, id├®ale apr├¿s l'entra├«nement.",kilogramme,1.8,60,Chocolate|Vanilla|Strawberry|Buttery Cinnamon,Croissance musculaire +15-20% post-workout prot├®ine 23g EAA window optimal ├®tude|Assimilation ultra-rapide 10-15g/heure fen├¬tre anabolique muscles directe|BCAA 5g ratio 2:1:1 anabolique mTOR stimulation force gains|EAA 11g profil complet acides amin├®s essentiels synth├¿se prot├®ine optimal|R├®cup├®ration acceler├®e post-training ATP resynthesis reconstruction fibre|Puret├® native extraction froide preservation bioactives lactoferrin immunoglobulins,"Contient: LAIT lactose composant naturel. SANS: gluten, soja, arachides, crustac├®s, ┼ôufs, aspartame | Traces possibles: atelier partag├®. Tol├®rance lactose: 1.7g/portion < 20g threshold = tolerable intol├®rant primaire l├®ger.",GMP,1-2 portions quotidienne standard. Post-workout imm├®diat 30g shaker optimal fen├¬tre anabolique. Petit-d├®jeuner optionnel 30g matin protein boost. Poids corporel 1.6-2g prot├®ines/kg poids exemple 80kg = 128-176g/jour = 4-6 portions combined alimentation+supplement.,235,130,185,,100,false,Premium Whey - 1800g | Impact Nutrition | Dodo Nutrition,Premium Whey - 1800g de Impact Nutrition est une prot├®ine premium pour la croissance et la r├®cup├®ration musculaire. Livraison rapide en Tunisie.
product-miravella-probio-vita-probiotiques-20-mds-ufc-60-capsules,Probio-Vita (Probiotiques 20 Mds UFC) - 60 Capsules,Miravella,vitamines,"Probio-Vita (Probiotiques 20 Mds UFC) - 60 Capsules de Miravella pour soutenir votre sant├® globale, votre immunit├® et vos performances sportives. Formule compl├¿te en vitamines et min├®raux essentiels.",g├®lule,60,30,,Digestion am├®lioration transit facilitation|Microbiote r├®├®quilibrage flore dysbiose|Ballonnements constipation diarrh├®e pr├®vention|Immunit├® 70% intestin renforcement|Synth├¿se vitamines B12 K intestinale|Mood ├®quilibre psychologique d├®pressionanxi├®t├® r├®duction,"CONTIENT: G├®latine sources possibles. G├®lule v├®g├®tale HPMC sans g├®latine allergie free (vegan compatible). Traces possibles: soja, gluten (atelier fabrication). .",GMP,"1-2 g├®lules quotidien avec repas. Cure 2-3 mois flore r├®├®quilibrage optimal, r├®p├®table toute ann├®e",40,20,30,,100,false,Probio-Vita (Probiotiques 20 Mds UFC) - 60 Capsules,Probio-Vita (Probiotiques 20 Mds UFC) - 60 Capsules - vitamines et min├®raux Miravella. Livraison express Tunisie. Commandez sur Dodo Nutrition.
product-miravella-prosta-confort-60-capsules,Prosta-Confort - 60 Capsules,Miravella,boosters,"Prosta-Confort - 60 Capsules de Miravella, booster naturel pour optimiser vos niveaux hormonaux, votre vitalit├® et vos performances physiques. Ingr├®dients naturels concentr├®s.",g├®lule,60,30,,Prostate sant├® troubles b├®nins BPH hyperplasie r├®duction|Mictions fr├®quentes nycturie jour nuit r├®duction|Jet urinaire faible am├®lioration vidange compl├¿te|Confort urinaire douleurs inconfort soulagement|Testost├®rone DHT conversion inhibition 5-alpha-r├®ductase|Inflammation prostate r├®duction racine ortie,"(plantes naturelles zinc). CONTIENT: G├®latine bovine Halal. D├®conseill├® femmes enceintes/allaitantes (pas concern├®es prostate), enfants < 18 ans (sant├® prostate hommes adultes), personnes traitement hormonal (consultation m├®decin interaction testost├®rone).",GMP|Halal|Halal Certifi├®,"2 g├®lules quotidien avec repas. Cure 3 mois minimum sympt├┤mes am├®lioration progressive, r├®p├®table plusieurs fois/an",55,30,45,,100,false,Prosta-Confort - 60 Capsules | Miravella | Dodo Nutrition,Prosta-Confort - 60 Capsules de Miravella. Booster hormonal de qualit├® pour vos objectifs fitness. Livraison rapide partout en Tunisie.
product-yava-labs-pure-iso-whey-2kg,Pure ISO Whey - 2kg,Yava Labs,proteines,"Pure ISO Whey - 2kg de Yava Labs est une prot├®ine premium pour la croissance et la r├®cup├®ration musculaire. Formule riche en acides amin├®s essentiels, id├®ale apr├¿s l'entra├«nement.",kilogramme,2,60,Multiples: Vanille|Fraise|Chocolat|Cookies Cream|Cr├¿me (selon batch),Synth├¿se prot├®ine musculaire 25g dense dose optimal BCAA Leucine-dominant|Croissance musculaire recovery post-training acceler├®e|Absorption rapide biodisponibilit├® PDCAAS 1.0 utilisation prot├®ine maximale|Glucides lipides minimaux faible kcal dense nutrition haute-efficacit├®|D├®finition musculaire lean gains gras minimal prise masse net positif|BCAA naturels anti-catabolisme protection muscle maigre,"CONTIENT: LAIT (whey lactose traces). Traces possibles: GLUTEN, ┼ÆUFS, S├ëSAME, FRUITS ├Ç COQUE, C├ëLERI (atelier partag├®). .",,30g (1 scoop) dans 300-400ml eau/lait par dose = 25g prot├®ine. Anytime flexible moment prise. Maximum 60g (2 scoops)/jour = 50g prot├®ine (tol├®rance ├®tablie bien support├®). Minimum 30g/jour (dosage efficace standard). Cure continue journali├¿re optimal sans interruption (prot├®ine s├╗re usage chronique).,260,145,205,,100,false,Pure ISO Whey - 2kg | Yava Labs | Dodo Nutrition,Pure ISO Whey - 2kg de Yava Labs est une prot├®ine premium pour la croissance et la r├®cup├®ration musculaire. Livraison rapide en Tunisie.
product-gsn-pure-whey-2kg,Pure Whey - 2kg,GSN,proteines,"Pure Whey - 2kg de GSN est une prot├®ine premium pour la croissance et la r├®cup├®ration musculaire. Formule riche en acides amin├®s essentiels, id├®ale apr├¿s l'entra├«nement.",kilogramme,2,67,Chocolat|Vanille|Fraise,Synth├¿se prot├®ine musculaire 25g dense dose optimal BCAA Leucine-dominant mTOR activ├®|Croissance musculaire recovery post-training acceler├®e absorption rapide|BCAA 5.5g anti-catabolisme protection muscle maigre|Glutamine 4.3g recovery cellulaire immunitaire support|Densit├® nutritionnel 25g/125 kcal ultra-efficace nutrition|Absorption rapide PDCAAS 0.99 utilisation prot├®ine maximale,"CONTIENT: LAIT (whey prot├®ines), SOJA (l├®cithine). Traces: GLUTEN, ┼ÆUFS, FRUITS ├Ç COQUE, GRAINES S├ëSAME, C├ëLERI. .",GMP|ISO 9001,30g (1 scoop) dans 250ml eau/lait par dose = 25g prot├®ine. Anytime flexible moment prise. Maximum 60g (2 scoops)/jour = 50g prot├®ine. Cure continue journali├¿re optimal sans interruption (prot├®ine s├╗re chronique).,260,145,205,,100,false,Pure Whey - 2kg | GSN | Dodo Nutrition,Pure Whey - 2kg de GSN est une prot├®ine premium pour la croissance et la r├®cup├®ration musculaire. Livraison rapide en Tunisie.
product-big-ramy-labs-red-rex-big-mass-5-44kg,RED REX Big Mass - 5.44kg,Big Ramy Labs,gainers,RED REX Big Mass de Big Ramy Labs est le mass gainer parfait pour les pratiquants de musculation qui ont du mal ├á prendre du poids et de la masse musculaire.,kilogramme,5.44,16,Chocolat (primary)|Multiples selon batch,Apport calorique MASSIF 1310 kcal/dose prise masse rapide ectomorphes|Double source prot├®ines absorption optimale synth├¿se prot├®ine musculaire|Cr├®atine 16g/dose force explosive endurance augment├®e 15-20%|Glutamine r├®cup├®ration cellulaire immunitaire support|Double source glucides ├®nergie progressive sans crash|BCAA complets anti-catabolisme protection muscle maigre,"CONTIENT: LAIT (whey prot├®ines concentr├®es). Traces possibles: GLUTEN, SOJA, ┼ÆUFS, POISSON, CRUSTAC├ëS, SULFITES (atelier). .",,"320g (4 scoops) dans 800-1000ml eau/lait par dose. 1-2 doses/jour selon besoins caloriques objectifs. JOURS TRAINING: 2 doses (post-workout + collation). JOURS REPOS: 1-2 doses selon faim objectives. Cure minimum 4 semaines, optimal 6-8 semaines prise mass.",655,360,510,,100,false,RED REX Big Mass - 5.44kg | Big Ramy Labs | Dodo Nutrition,RED REX Big Mass - 5.44kg de Big Ramy Labs. Gainer prise de masse de qualit├® pour vos objectifs fitness. Livraison rapide partout en Tunisie.
product-real-pharm-real-mass-6-8kg,Real Mass - 6.8kg,Real Pharm,gainers,Real Mass de Real Pharm est le mass gainer parfait pour les pratiquants de musculation qui ont du mal ├á prendre du poids et de la masse musculaire.,kilogramme,6.8,90,Chocolat|Vanille|Banane|Fraise|Caramel|Tiramisu,4 sources prot├®ines absorption progressive optimale (rapide+lente)|282 kcal/dose apport ├®nerg├®tique ├®lev├®|BCAA 17.42g/100g prot├®ines anti-catabolisme muscle|4 sources glucides ├®nergie imm├®diate+prolong├®e|EAA complets 37.19g/100g profil acides amin├®s|Glutamine 14g/100g r├®cup├®ration cellulaire,"Contient: LAIT. Traces possibles: SOJA, GLUTEN, ┼ÆUFS, POISSON, CRUSTAC├ëS, SULFITES.",,75g (2 cuill├¿res doseuses) dans 150-250ml eau ou lait. Consommer 2 fois/jour (apr├¿s training + collation). Jusqu'├á 4 fois/jour selon besoins (max 300g/jour),815,450,635,,100,true,Real Mass - 6.8kg | Real Pharm | Dodo Nutrition,Real Mass - 6.8kg de Real Pharm. Gainer prise de masse de qualit├® pour vos objectifs fitness. Livraison rapide partout en Tunisie.
product-real-pharm-real-mass-gold-edition-3kg,Real Mass Gold Edition - 3kg,Real Pharm,gainers,Real Mass Gold Edition de Real Pharm est le mass gainer parfait pour les pratiquants de musculation qui ont du mal ├á prendre du poids et de la masse musculaire.,kilogramme,3,40,Chocolat|Vanille|Vanille-Berry,20% prot├®ines concentration ├®lev├®e vs Real Mass standard|12 Vitamines couverture micronutriments optimale (C E A B-complex)|5 Min├®raux essentiels (Ca Mg K P Na) ├®quilibre ├®lectrolytes|Glucides sains Maltodextrine Dextrose Avoine ├®nergie progressive|Croissance musculaire rapide phases prise masse|R├®cup├®ration acc├®l├®r├®e micronutriments antioxydants,"Contient: LAIT (concentration ├®lev├®e lait premium). Traces possibles: GLUTEN, SOJA, ┼ÆUFS. G├®latine option.",,"75g (2 cuill├¿res) dans 250-300ml eau ou lait, 1-3 portions/jour selon besoins caloriques objectifs",360,200,280,,100,false,Real Mass Gold Edition - 3kg | Real Pharm | Dodo Nutrition,Real Mass Gold Edition - 3kg de Real Pharm. Gainer prise de masse de qualit├® pour vos objectifs fitness. Livraison rapide partout en Tunisie.
product-real-pharm-real-viking-360g,Real Viking - 360g,Real Pharm,pre-workout,"Real Viking - 360g de Real Pharm, booster pr├®-entra├«nement pour une ├®nergie explosive, un focus mental accru et une endurance prolong├®e pendant vos s├®ances.",gramme,360,30,Maracuja,AAKG circulation production NO maximale|20 ingr├®dients ├®nergie multisource compl├¿te|Pump vasculaire intense congestion musculaire|Caf├®ine naturelle guarana ├®nergie sans crash|Antioxydants flavonoides cacao protection cellulaire|Thermogen├¿se orange am├¿re d├®pense ├®nerg├®tique,Contient: Syn├®phrine (orange am├¿re) . Traces possibles: gluten soja. .,,"6-12g dans 200-250ml eau, 15-20min AVANT training. Commencer 6g tester tol├®rance avant augmenter 12g. Maximum 12g/jour ne pas d├®passer.",70,40,55,,100,false,Real Viking - 360g | Real Pharm | Dodo Nutrition,Real Viking - 360g de Real Pharm. Pre-workout de qualit├® pour vos objectifs fitness. Livraison rapide partout en Tunisie.
product-applied-nutrition-shaker-600g,Shaker - 600g,Applied Nutrition,accessoires,"Shaker - 600g de Applied Nutrition, accessoire de qualit├® pour accompagner vos entra├«nements. Con├ºu pour la durabilit├® et le confort.",millilitre,600,,,,Aucun allerg├¿ne (accessoire non-alimentaire). Plastique sans BPA certifi├® s├®curit├® alimentaire EU. Ingr├®dients z├®ro allerginiques.,ISO 22000,Non applicable (accessoire r├®utilisable - pas dosage). R├®utilisable quotidiennement ind├®finiment - remplacer si usure/dommage.,20,10,15,,100,false,Shaker - 600g | Applied Nutrition | Dodo Nutrition,"Shaker - 600g de Applied Nutrition, accessoire de qualit├® pour accompagner vos entra├«nements. Livraison rapide en Tunisie."
product-applied-nutrition-shed-h2o-180-capsules,Shed H2O - 180 Capsules,Applied Nutrition,bruleurs,Shed H2O - 180 Capsules de Applied Nutrition est un br├╗leur de graisse qui acc├®l├¿re le m├®tabolisme et favorise la perte de poids. Formule thermog├®nique pour une s├¿che efficace.,capsule,180,30,,,"ALLERG├êNE MAJEUR: C├®leri (d├®clar├® gras - constituant actif). Peut contenir traces: soja, gluten, lait, ┼ôuf, crustac├®s, arachide",GMP|ISO 22000|Halal|Halal Certifi├®|Informed Sport,"Dose standard pr├®-comp├®tition: 1 dose (6 caps) matin avec nourriture, optionnel 1 dose suppl├®mentaire 6-8h apr├¿s (utilisateurs exp├®riment├®s) NE PAS D├ëPASSER 2 doses/jour (160mg caf├®ine/jour) Dur├®e: 2-7 jours pr├®-comp├®tition (pique effet jour 3-4) Consommation d'eau: MINIMAL 2 litres/jour (hyper-i...",120,65,95,,100,false,Shed H2O - 180 Capsules | Applied Nutrition | Dodo Nutrition,Shed H2O - 180 Capsules de Applied Nutrition. Br├╗leur de graisse de qualit├® pour vos objectifs fitness. Livraison rapide partout en Tunisie.
product-miravella-shilajit-20-acide-fulvique-60-capsules,Shilajit (20% Acide Fulvique) - 60 Capsules,Miravella,boosters,"Shilajit (20% Acide Fulvique) - 60 Capsules de Miravella, booster naturel pour optimiser vos niveaux hormonaux, votre vitalit├® et vos performances physiques. Ingr├®dients naturels concentr├®s.",g├®lule,60,30,,├ënergie vitalit├® tonus boost naturel fatigue chronique combat|Libido testost├®rone 15-20% augmentation fonction sexuelle|R├®cup├®ration musculaire post-training inflammation douleurs r├®duction|Adaptog├¿ne stress r├®sistance conditions difficiles am├®lioration|Antioxydant puissant radicaux libres neutralisation protection|D├®toxification m├®taux lourds toxines ch├®lation ├®limination,"(shilajit r├®sine naturelle). CONTIENT: G├®latine bovine Halal, Fer ├®lev├® (inappropri├® h├®mochromatose niveau fer sang ├®lev├®). D├®conseill├® femmes enceintes/allaitantes (donn├®es insuffisantes), personnes probl├¿mes r├®naux acide urique ├®lev├® (consultation m├®decin), enfants < 12 ans (adaptation dosage).",GMP|Halal|Halal Certifi├®,"1-2 g├®lules quotidien pendant repas. Cure 2-3 mois r├®sultats optimaux ├®nergie libido, r├®p├®table plusieurs fois/an",55,30,45,,100,false,Shilajit (20% Acide Fulvique) - 60 Capsules | Miravella,Shilajit (20% Acide Fulvique) - 60 Capsules de Miravella. Booster hormonal de qualit├® pour vos objectifs fitness. Livraison rapide partout en Tunisie.
product-applied-nutrition-shred-x-ultimate-fat-burner-300g,Shred X Ultimate Fat Burner - 300g,Applied Nutrition,bruleurs,Shred X Ultimate Fat Burner - 300g de Applied Nutrition est un br├╗leur de graisse qui acc├®l├¿re le m├®tabolisme et favorise la perte de poids. Formule thermog├®nique pour une s├¿che efficace.,gramme,300,30,Lemon Ice Tea|Sour Gummy Bear|Strawberry Kiwi,,"Peut contenir soja, crustac├®s (traces atelier partag├®). Contient caf├®ine (200mg/dose) - d├®conseill├® sensibilit├® caf├®ine. Contient colorants: tartrazine E102 (Lemon Ice Tea) - allergie potentielle asthme.",GMP|Halal|Halal Certifi├®,Dose standard: 1 scoop (10g) 15 min avant entra├«nement cardio Dose maximale: 1 scoop matin (15 min avant cardio) + optionnel 1 scoop apr├¿s-midi NE PAS D├ëPASSER 2 doses/jour (400mg caf├®ine/jour limite recommand├®e) NE PAS CONSOMMER sur estomac vide (absorption optimale + GI confort) Dur├®e: 8-12 sem...,65,35,50,,100,false,Shred X Ultimate Fat Burner - 300g | Applied Nutrition,Shred X Ultimate Fat Burner - 300g de Applied Nutrition. Br├╗leur de graisse de qualit├® pour vos objectifs fitness. Livraison rapide partout en Tunisie.
