_id,name,brand,category,description,unit,quantity,servings,flavors,benefits,allergens,certifications,dosage,priceRetail,pricePurchase,priceWholesale,priceSlashed,stock,featured,metaTitle,metaDescription
product-ostrovit-100-creatine-500g,100% Creatine - 500g,OstroVit,creatine,"100% Creatine - 500g de OstroVit, cr├®atine pure pour augmenter la force, la puissance et les performances musculaires. Le suppl├®ment le plus ├®tudi├® scientifiquement.",gramme,500,166,Naturel sans ar├┤mes additifs,Force explosion +15-20% creatine monohydrate ATP phosphocreatine documented ├®tude clinique|Performance power output halt├®rophilie bodybuilding intense repetitions peak force|Endurance musculaire consecutive short intense physical exercise improvement|Volume cellulaire intracellular hydration pump muscle aesthetic|Recovery ATP resynthesis faster restoration inter-set inter-training|Concentration mental focus cognitive function creatine cerebral energy,"POUDRE PURE 100% CREATINE. AUCUN allerg├¿ne majeur identifi├®. SANS: gluten, soja, lait, arachides, crustac├®s, ┼ôufs, aspartame, sucre, gras. . .",GMP|Vegan,Dose standard 3g quotidienne suffisante pour majority athletes. Jour entra├«nement: 1 portion 3g post-training imm├®diat avec carbs+ prot├®ine amplify insulin-creatine uptake optimization. Jour repos: 1 portion 3g r├®veil anytime flexibility.,55,30,45,,100,false,100% Creatine - 500g | OstroVit | Dodo Nutrition,"100% Creatine - 500g de OstroVit, cr├®atine pure pour augmenter la force, la puissance et les performances musculaires. Livraison rapide en Tunisie."
product-muscletech-100-mass-gainer-2-33kg,100% Mass Gainer - 2.33kg,MuscleTech,gainers,100% Mass Gainer de MuscleTech est le mass gainer parfait pour les pratiquants de musculation qui ont du mal ├á prendre du poids et de la masse musculaire.,kilogramme,2.33,6,Multiples: Chocolat|Vanille|Fraise (selon batch),Apport calorique MASSIF 1330-1500 kcal/dose prise masse rapide hard gainers ectomorphes difficult├®s|Double source prot├®ines absorption duplex synth├¿se musculaire optimale (concentr├®+isolat+hydrolyz├®)|Cr├®atine 5g/dose force explosive endurance augmentation 15-20% ├®tudes|L-Glutamine 7.5g recovery cellulaire immunitaire support|BCAA complets anti-catabolisme protection muscle maigre durant surplus calorique|ModCarb complex glucides progression saine fibre min├®raux vs dextrose simple crash,"CONTIENT: LAIT (whey concentr├® isolate cas├®inate, lactose traces). PEUT CONTENIR TRACES: SOJA (lecithin), ┼ÆUFS, POISSON, CRUSTAC├ëS, ARRACHIDES (atelier). .",,357g (6 scoops) dans 475ml eau/lait par dose = 1330-1500 kcal. 1 dose/jour standard maintenance nutrition. 2 doses/jour acc├®l├®ration prise mass intensive (2600-3000 kcal gainer supplement). JOURS TRAINING: post-workout prioritaire fen├¬tre anabolique.,280,155,220,,100,false,100% Mass Gainer - 2.33kg | MuscleTech | Dodo Nutrition,100% Mass Gainer - 2.33kg de MuscleTech. Gainer prise de masse de qualit├® pour vos objectifs fitness. Livraison rapide partout en Tunisie.
product-bpi-sports-a-hd-elite-500mg-30-capsules,A-HD Elite 500mg - 30 Capsules,BPI Sports,boosters,"A-HD Elite 500mg 30 Caps de BPI Sports est le booster de testost├®rone naturel con├ºu pour optimiser vos niveaux hormonaux, augmenter votre force, votre masse musculaire et votre libido.",g├®lule,30,30,,Testost├®rone support naturelle botanicals prohormone precursors document├®|Masse musculaire augmentation anabolic support lean muscle gain|Force explosion performance androg├®nique stimulation|Libido improvement DHT conversion Zinc cofacteur|Endurance physique performance cardiovasculaire support|├ënergie vitality general tone adaptogen botanicals,"Sans allerg├¿nes majeurs identifi├®s | Traces possibles: Atelier partag├® gluten, soja, arachides, poisson, crustac├®s |",,"Dose: 1 g├®lule quotidienne suffisante ultra-concentrated proprietary 500mg blend. Prendre matin je├╗n optimal absorption 30min avant nourriture ou avec petit-d├®jeuner protein riche lipides facilite absorption. Cycle 4 semaines standard, maximum 8 semaines consecutive.",45,25,35,,100,false,A-HD Elite 500mg - 30 Capsules | BPI Sports | Dodo Nutrition,A-HD Elite 500mg - 30 Capsules de BPI Sports. Booster hormonal de qualit├® pour vos objectifs fitness. Livraison rapide partout en Tunisie.
product-nutrex-anabol-hardcoreiqui-caps-60-capsules,Anabol Hardcoreiqui-Caps - 60 Capsules,Nutrex,boosters,"Anabol Hardcore 60 Liqui-Caps de Nutrex est le booster de testost├®rone naturel con├ºu pour optimiser vos niveaux hormonaux, augmenter votre force, votre masse musculaire et votre libido.",capsule,60,30,,Testost├®rone stimulation naturelle dicyclopentanone conversion DHT optimale|Croissance musculaire maigre explosive hardcore 20-30% gains 8-12 semaines ├®tudes|Force maximale power output performance halt├®rophilie musculation|Hardness densit├® d├®finition musculaire ultra-s├¿che look comp├®titeurs|R├®cup├®ration rapide inter-training catabolisme minimal nuit|├ënergie aggression training mental focus intensit├® extr├¬me,"identifi├®. Capsule V├ëG├ëTALE (glyc├®rol base, non g├®latine animal). SANS: gluten, soja, lait, arachides, crustac├®s, ┼ôufs, poisson. .",,"2 capsules quotidienne standard. Prendre 1 capsule matin je├╗n 30min avant petit-d├®jeuner absorption optimale. Prendre 1 capsule soir 18h+ (caf├®ine absence, hormonaux nocturnes consid├®ration). Cycle 12 semaines ON obligatoire r├®sultats maximaux croissance durable.",55,30,45,,100,false,Anabol Hardcoreiqui-Caps - 60 Capsules | Nutrex Tunisie,Anabol Hardcoreiqui-Caps - 60 Capsules de Nutrex. Booster hormonal de qualit├® pour vos objectifs fitness. Livraison rapide partout en Tunisie.
product-impact-nutrition-anabolic-mass-gainer-5000g,Anabolic Mass Gainer - 5000g,Impact Nutrition,gainers,Anabolic Mass Gainer 5kg de Impact Nutrition est le mass gainer parfait pour les pratiquants de musculation qui ont du mal ├á prendre du poids et de la masse musculaire.,kilogramme,5,31,Chocolate|Vanille|Caramel|Banoffee,Prise masse explosive ratio 4:1 +40-60% gains intensif|Surplus calorique 572 kcal/portion maintenance d├®passement|Carbs complexes 107g rapides ATP restoration|Prot├®ines 25g compl├¿tes synth├¿se maximale|Avoine fiber digestibilit├® optimale|Vitamines 12 + Min├®raux 5 ch├®lat├®s absorption,"Contient LAIT (whey) GLUTEN (avoine). SANS: arachides, crustac├®s | TRACES: soja oeufs",GMP,160g portion quotidienne minimum. Post-training 160g immediate recovery. Alternative 2 portions 320g/jour hardgainer intensif. Maximum 3 portions intensif training multiple sessions.,600,330,470,,100,false,Anabolic Mass Gainer - 5000g | Impact Nutrition Tunisie,Anabolic Mass Gainer - 5000g de Impact Nutrition. Gainer prise de masse de qualit├® pour vos objectifs fitness. Livraison rapide partout en Tunisie.
product-real-pharm-anabolic-real-mass-3000g,Anabolic Real Mass - 3000g,Real Pharm,gainers,Anabolic Real Mass 3kg de Real Pharm est le mass gainer parfait pour les pratiquants de musculation qui ont du mal ├á prendre du poids et de la masse musculaire.,kilogramme,3,40,Chocolat|Vanille,,"ALLERG├êNE PRINCIPAL: LAIT - whey (concentr├®, isolat, hydrolysat), cas├®ine. Peut contenir: soja, ┼ôuf, gluten, crustac├®s",GMP|ISO 9001,Phase prise de masse intensive: 75g (2 scoops) trois fois par jour = 900kcal/jour additionnel Phase mod├®r├®e: 75g deux fois par jour = 600kcal/jour Dosage maximum recommand├®: 300g poudre par jour Dur├®e: minimum 8-12 semaines phase de volume pour r├®sultats significatifs,360,200,280,,100,false,Anabolic Real Mass - 3000g | Real Pharm | Dodo Nutrition,Anabolic Real Mass - 3000g de Real Pharm. Gainer prise de masse de qualit├® pour vos objectifs fitness. Livraison rapide partout en Tunisie.
product-miravella-ashwagandha-5-withanolides-60-capsules,Ashwagandha (5% Withanolides) - 60 Capsules,Miravella,boosters,"Ashwagandha (5% Withanolides) - 60 Capsules de Miravella, booster naturel pour optimiser vos niveaux hormonaux, votre vitalit├® et vos performances physiques. Ingr├®dients naturels concentr├®s.",g├®lule,60,15,,Stress anxi├®t├® r├®duction cortisol 20-30% diminution|Sommeil qualit├® am├®lioration apparition profond r├®parateur|├ënergie vitalit├® augmentation fatigue chronique combat|Testost├®rone libido masculin normalisation 15-20% augmentation|Fonction cognitive m├®moire concentration focus stimulation|Prise masse musculaire construction r├®cup├®ration cortisol r├®duction,(ashwagandha plante naturelle). CONTIENT: G├®latine bovine Halal. .,GMP|Halal|Halal Certifi├®,"2-4 g├®lules quotidien (2 matin, 2 soir pr├®f├®rence). Cure 3 mois maximum arr├¬t semaine tous 21 jours r├®p├®table",55,30,45,,100,false,Ashwagandha (5% Withanolides) - 60 Capsules | Miravella,Ashwagandha (5% Withanolides) - 60 Capsules de Miravella. Booster hormonal de qualit├® pour vos objectifs fitness. Livraison rapide partout en Tunisie.
product-biotech-usa-ashwagandha-60-capsules,Ashwagandha - 60 Capsules,Biotech USA,boosters,"Ashwagandha - 60 Capsules de Biotech USA, booster naturel pour optimiser vos niveaux hormonaux, votre vitalit├® et vos performances physiques. Ingr├®dients naturels concentr├®s.",g├®lule,60,60,,R├®duction stress cortisol regulation adaptog├¿ne somnifera withania documented clinique ├®tude|Am├®lioration sommeil qualit├® nuit withanolides somnine somniferine tryptophane|├ëquilibre mental clarity focus concentration GABA serotonin dopamine|Anxi├®t├® natural management adaptog├¿ne sans addiction dependence safety|R├®cup├®ration stress physique mental reconstruction ├®nergie restoration|Endurance ├®nergique resilience fatigue nerveuse resistance stress chronique,"G├®lule G├ëLATINE (option v├®g├®tale disponible). AUCUN allerg├¿ne majeur identifi├®. SANS: gluten, soja, lait, arachides, crustac├®s, ┼ôufs, sucre. Consultable: femmes enceintes/allaitantes donn├®es suffisantes.",GMP,"1 g├®lule quotidienne standard suffisante. Prendre soir avant coucher optimal sommeil support (30-45min avant sommeil ideal). Alternative: matin petit-d├®jeuner flexibility. Cure minimum 4 semaines r├®sultats premiers visibles, optimal 8-12 semaines int├®gration biochimique.",55,30,45,,100,false,Ashwagandha - 60 Capsules | Biotech USA | Dodo Nutrition,Ashwagandha - 60 Capsules de Biotech USA. Booster hormonal de qualit├® pour vos objectifs fitness. Livraison rapide partout en Tunisie.
product-real-pharm-ashwagandha-100-naturel-90g,Ashwagandha 100% Naturel - 90g,Real Pharm,boosters,"Ashwagandha 100% Naturel - 90g de Real Pharm, booster naturel pour optimiser vos niveaux hormonaux, votre vitalit├® et vos performances physiques. Ingr├®dients naturels concentr├®s.",comprim├®,90,45,,R├®duction stress cortisol withanolides|Am├®lioration qualit├® sommeil relaxation|Vitalit├® ├®nergie g├®n├®rale tonique|Support syst├¿me nerveux ├®quilibre ├®motionnel|R├®cup├®ration post-training musculaire|Concentration focus mental am├®lior├®,"Traces possibles: GLUTEN, SOJA (atelier). .",GMP|ISO 9001|EFSA,"2 comprim├®s/jour dose standard (600mg). Minimum 1/jour maintenance. Maximum 4/jour tol├®rance ├®tablie. Cure 4-6 semaines r├®sultats, optimal 8-12 semaines, longue dur├®e s├®curis├®e.",65,35,50,,100,false,Ashwagandha 100% Naturel - 90g | Real Pharm | Dodo Nutrition,Ashwagandha 100% Naturel - 90g de Real Pharm. Booster hormonal de qualit├® pour vos objectifs fitness. Livraison rapide partout en Tunisie.
product-olimp-ashwagandha-600-sport-edition-60-capsules,Ashwagandha 600 Sport Edition - 60 Capsules,Olimp,boosters,"Ashwagandha 600 Sport Edition - 60 Capsules de Olimp, booster naturel pour optimiser vos niveaux hormonaux, votre vitalit├® et vos performances physiques. Ingr├®dients naturels concentr├®s.",g├®lule,60,30,,R├®cup├®ration post-training acc├®l├®r├®e|R├®sistance au stress r├®duit|Vitalit├® ├®nergie augment├®e|Focus mental am├®lior├®|Endurance musculaire soutenue|Adaptog├¿ne naturel sans stimulants,"CONTIENT: G├®latine bovine. Traces: gluten, soja (atelier).",,"2 g├®lules quotidien avec repas. Minimum 4-6 semaines r├®sultats, optimal 8-12 semaines",55,30,45,,100,false,Ashwagandha 600 Sport Edition - 60 Capsules | Olimp Tunisie,Ashwagandha 600 Sport Edition - 60 Capsules de Olimp. Booster hormonal de qualit├® pour vos objectifs fitness. Livraison rapide partout en Tunisie.
product-impact-nutrition-bcaa-2-1-1-perform-c-300g,BCAA 2:1:1 Perform C - 300g,Impact Nutrition,acides-amines,BCAA 2:1:1 Perform C 300g de Impact Nutrition fournit les acides amin├®s essentiels dont vos muscles ont besoin pour une r├®cup├®ration optimale et une croissance musculaire maximale.,gramme,300,30,Citron|Orange|Tropical|Raisin (ar├┤mes naturels),Anti-catabolisme BCAA frein d├®gradation musculaire intra-workout|Synth├¿se prot├®ine L-Leucine mTOR stimulation maximale|Endurance musculaire BCAA fuel amino-acid directe|R├®cup├®ration acc├®l├®r├®e inter-set rapide restauration|Anti-fatigue Vitamine C 80mg VQ ├®nergie|Source v├®g├®tale ferment├®e puret├® naturelle,"AUCUN allerg├¿ne majeur. Ferment├®s source V├ëG├ëTALE pure non-animale. SANS: gluten, soja, lait, arachides, crustac├®s. Vegan-friendly compatible.",GMP,10g portion (1 cuill├¿re-doseuse remplissante) quotidienne intra-workout standard. Prendre pendant training 30-60 minutes effort intensif. Flexible anytime hydration. Maxi 30g jour si multiple sessions.,60,35,45,,100,true,BCAA 2:1:1 Perform C - 300g | Impact Nutrition Tunisie,BCAA 2:1:1 Perform C - 300g de Impact Nutrition. Acides amin├®s de qualit├® pour vos objectifs fitness. Livraison rapide partout en Tunisie.
product-scenit-nutrition-bcaa-gluta-500g,BCAA Gluta - 500g,Scenit Nutrition,acides-amines,BCAA Gluta 500g de Scenit Nutrition fournit les acides amin├®s essentiels dont vos muscles ont besoin pour une r├®cup├®ration optimale et une croissance musculaire maximale.,gramme,500,100,Citron gla├º├®|Orange|Cola Rafra├«chissant,,"Peut contenir: lactose, ┼ôuf, soja, gluten, crustac├®s (fabrication en atelier partag├®)",GMP|ISO 9001,Phase force/volume: 5g apr├¿s entra├«nement et avant sommeil Phase d├®finition: 5g avant et apr├¿s entra├«nement (10g/jour total) Usage quotidien: 5-10g r├®partis en doses de 5g,75,40,60,,100,false,BCAA Gluta - 500g | Scenit Nutrition | Dodo Nutrition,BCAA Gluta - 500g de Scenit Nutrition. Acides amin├®s de qualit├® pour vos objectifs fitness. Livraison rapide partout en Tunisie.
product-real-pharm-behemoth-pre-workout-500g,Behemoth Pre-Workout - 500g,Real Pharm,pre-workout,"Behemoth Pre-Workout - 500g de Real Pharm, booster pr├®-entra├«nement pour une ├®nergie explosive, un focus mental accru et une endurance prolong├®e pendant vos s├®ances.",gramme,500,50,,├ënergie explosive imm├®diate caf├®ine 300mg|Concentration focus maximum Tyrosine|Pump vasculaire intense Citrulline 2g|Endurance augment├®e B├¬ta-alanine tampon lactate|R├®duction fatigue sensorielle Taurine|Antioxydants protection Th├® Vert,Traces possibles: gluten soja (atelier). .,,"10-20g (1-2 dosettes) dans 200ml eau, 30min AVANT training. Commencer 10g tester tol├®rance. Maximum 20g/jour ne pas d├®passer.",85,45,65,,100,true,Behemoth Pre-Workout - 500g | Real Pharm | Dodo Nutrition,Behemoth Pre-Workout - 500g de Real Pharm. Pre-workout de qualit├® pour vos objectifs fitness. Livraison rapide partout en Tunisie.
product-scenit-nutrition-best-collagen-premium-350g,Best Collagen Premium - 350g,Scenit Nutrition,vitamines,"Best Collagen Premium - 350g de Scenit Nutrition pour soutenir votre sant├® globale, votre immunit├® et vos performances sportives. Formule compl├¿te en vitamines et min├®raux essentiels.",gramme,350,35,,Ongles,"Peut contenir: poisson, crustac├®s, lactose, soja (production en atelier multiprot├®ines)",GMP|ISO 9001,Dose standard: 10g par jour (1 mesure) Dose optimale: 20g par jour (2 mesures divis├®es matin/soir) Dur├®e minimale: 4-8 semaines pour r├®sultats perceptibles Dur├®e recommand├®e: utilisation continue 2-3 mois minimum,35,20,25,,100,false,Best Collagen Premium - 350g | Scenit Nutrition Tunisie,Best Collagen Premium - 350g de Scenit Nutrition. Vitamines et min├®raux de qualit├® pour vos objectifs fitness. Livraison rapide partout en Tunisie.
product-scenit-nutrition-best-creatine-1kg,Best Creatine - 1kg,Scenit Nutrition,creatine,"Best Creatine - 1kg de Scenit Nutrition, cr├®atine pure pour augmenter la force, la puissance et les performances musculaires. Le suppl├®ment le plus ├®tudi├® scientifiquement.",kilogramme,1,100,,100% pure micronis├®e absorption ultra-rapide|Puret├® 99.9% certifi├®e laboratoire EFSA|Augmente cr├®atine phosphate ATP ├®nergie|Augmente force 15-20% ├®tudes scientifiques|Am├®liore performance ana├®robie haute intensit├®|R├®cup├®ration acc├®l├®r├®e ATP resynth├¿se,AUCUN allerg├¿ne direct. Traces possibles: GLUTEN (atelier partag├®). .,GMP|EFSA,"5g (cuill├¿re doseuse) dissolue 200ml eau 1x/jour. Phase charge optionnelle: 20g/jour (4├ù5g) jours 1-7, puis 5g/jour maintenance. Cure minimum 4-6 semaines r├®sultats notables.",55,30,45,,100,false,Best Creatine - 1kg | Scenit Nutrition | Dodo Nutrition,Best Creatine - 1kg de Scenit Nutrition. Cr├®atine de qualit├® pour vos objectifs fitness. Livraison rapide partout en Tunisie.
product-real-pharm-beta-alanine-300g,Beta Alanine - 300g,Real Pharm,acides-amines,"Beta Alanine - 300g de Real Pharm, acides amin├®s essentiels pour la r├®cup├®ration musculaire et la r├®duction des courbatures. Soutient la synth├¿se prot├®ique et l'endurance.",gramme,300,100,Orange|Fraise-Past├¿que,,"Sans allerg├¿nes majeurs d├®clar├®s. COLORANTS peuvent intol├®rance (Tartrazine E102 - sensibilit├® asthme potentielle, Cochenille E120 - rare allergie). Peut contenir: lactose, ┼ôuf, soja, gluten, crustac├®s",GMP|EFSA,Dose standard: 3g une fois quotidien (100 servings = 100 jours approvisionnement) Dose possible: 1.,60,35,45,,100,false,Beta Alanine - 300g | Real Pharm | Dodo Nutrition,Beta Alanine - 300g de Real Pharm. Acides amin├®s de qualit├® pour vos objectifs fitness. Livraison rapide partout en Tunisie.
product-gsn-big-mass-gainer-3kg,Big Mass Gainer - 3kg,GSN,gainers,Big Mass Gainer de GSN est le mass gainer parfait pour les pratiquants de musculation qui ont du mal ├á prendre du poids et de la masse musculaire.,kilogramme,3,17,Multiples: Chocolat|Fraise|Vanille (selon batch),Apport calorique MASSIF 1351 kcal/dose prise masse rapide hard gainers ultra-difficiles|Prot├®ines 80g densit├® ultra-concentr├®e synth├¿se musculaire optimale|Cr├®atine 3g force explosive ATP production endurance|BCAA 18g anti-catabolisme protection muscle maigre|Glucides 250g ├®nergie progressive entra├«nement soutenu|Double source prot├®ines absorption duplex,"CONTIENT: LAIT (whey prot├®ines, cas├®inate), SOJA (l├®cithine). Traces: GLUTEN, ┼ÆUFS, GRAINES S├ëSAME, FRUITS ├Ç COQUE (atelier). .",GMP,180g (2 scoops) dans 350ml eau/lait par dose = 1351 kcal. 1 dose/jour standard. 2 doses/jour acc├®l├®ration intensive prise mass (2702 kcal gainer). Cure 4-8 semaines prise mass rapide.,360,200,280,,100,false,Big Mass Gainer - 3kg | GSN | Dodo Nutrition,Big Mass Gainer - 3kg de GSN. Gainer prise de masse de qualit├® pour vos objectifs fitness. Livraison rapide partout en Tunisie.
product-yava-labs-bulk-mass-breon-signature-3kg,Bulk Mass BREON Signature - 3kg,Yava Labs,gainers,Bulk Mass BREON Signature de Yava Labs est le mass gainer parfait pour les pratiquants de musculation qui ont du mal ├á prendre du poids et de la masse musculaire.,kilogramme,3,15,Multiples: Cookies Cream|Chocolat Coconut|Fraise|Vanille (selon batch),Prise masse MAIGRE muscle pur 76% glucides / 27% prot├®ines optimal lean gain|Cr├®atine 2g mod├®r├®e force raisonnable ATP production|Prot├®ines 48g whey qualit├® synth├¿se prot├®ine musculaire directe|Glucides 138g ├®nergie progressive entra├«nement soutenu|Lipides minimal 2.5g faible graisse d├®position clean gain|├ëquilibre calories 720 kcal MOD├ëR├ë vs 1000+ hardcore (contr├┤le prise gras),"CONTIENT: LAIT (whey, lactose). Traces possibles: GLUTEN, ┼ÆUFS, GRAINES S├ëSAME, FRUITS ├Ç COQUE, C├ëLERI (atelier partag├®). .",,200g (3.5 scoops) dans 400-500ml eau par dose = ~720 kcal. 1 dose/jour standard maintenance nutrition. 1-2 doses/jour flexible selon besoins caloriques. POST-WORKOUT: 200g 30-45min apr├¿s (recovery fen├¬tre anabolique). MATIN: 200g petit-d├®jeuner ├®nergie soutenue.,360,200,280,,100,false,Bulk Mass BREON Signature - 3kg | Yava Labs | Dodo Nutrition,Bulk Mass BREON Signature - 3kg de Yava Labs. Gainer prise de masse de qualit├® pour vos objectifs fitness. Livraison rapide partout en Tunisie.
product-applied-nutrition-cla-l-carnitine-green-tea-100g,CLA + L-Carnitine & Green Tea - 100g,Applied Nutrition,bruleurs,CLA + L-Carnitine & Green Tea - 100g de Applied Nutrition est un br├╗leur de graisse qui acc├®l├¿re le m├®tabolisme et favorise la perte de poids. Formule thermog├®nique pour une s├¿che efficace.,g├®lule,100,50,,Composition corporelle optimization CLA +L-carnitine+EGCG triple-synergy -3-5kg graisse 8-12 semaines ├®tude|Pr├®vention stockage graisse nouveau CLA inhibition adipocyte lipoprot├®ine lipase|Mobilisation graisse L-Carnitine transport ╬▓-oxydation mitochondries|Thermogen├¿se boosting Th├® Vert EGCG noradr├®naline cat├®cholamines 4-6% d├®pense calorique|Oxydation lipides maximale triple synergie vs single-ingredient simple|Pr├®servation muscle maigre L-Carnitine anti-catabolisme proteines,"G├®latine V├ëG├ëTALE (vegan-friendly compatible), AUCUN allerg├¿ne majeur identifi├®. SANS: gluten, soja, lait, arachides, crustac├®s, ┼ôufs, poisson, sulfites. .",Halal|Vegan,"2 softgels quotidienne standard suffisante. Prendre 1 softgel matin petit-d├®jeuner, 1 softgel soir avant d├«ner r├®gularit├® sym├®trique 12h espac├®es. Alternative: 2 softgels une fois matin ou soir flexibility. Avec repas contenant graisses (favorise absorption CLA L-carnitine optimal).",80,45,60,,100,false,CLA + L-Carnitine & Green Tea - 100g | Applied Nutrition,CLA + L-Carnitine & Green Tea - 100g de Applied Nutrition. Br├╗leur de graisse de qualit├® pour vos objectifs fitness. Livraison rapide partout en Tunisie.
product-v-shape-supplements-cla-l-carnitine-200g,CLA + L-Carnitine - 200g,V-Shape Supplements,bruleurs,CLA + L-Carnitine - 200g de V-Shape Supplements est un br├╗leur de graisse qui acc├®l├¿re le m├®tabolisme et favorise la perte de poids. Formule thermog├®nique pour une s├¿che efficace.,gramme,200,40,Fruit Punch (standard),,Peut contenir lait (CLA source boeuf). Peut contenir soja (atelier partag├®). G├®n├®ralement bien-tol├®r├® v├®g├®tariens/v├®gans si CLA source synth├®tique confirm├®e,GMP,Standard: 1 scoop (5g) quotidien phase s├¿che Phase intensive: 2 scoops (10g) matin + soir doubl├® effet Dur├®e minimale: 12 semaines phase s├¿che continu r├®sultats Dur├®e maximale: 16-20 semaines s├¿che d├®finition extr├¬me,50,30,40,,100,false,CLA + L-Carnitine - 200g | V-Shape Supplements Tunisie,CLA + L-Carnitine - 200g de V-Shape Supplements. Br├╗leur de graisse de qualit├® pour vos objectifs fitness. Livraison rapide partout en Tunisie.
product-yava-labs-carb-loader-2kg,Carb Loader - 2kg,Yava Labs,gainers,Carb Loader - 2kg de Yava Labs est un gainer riche en prot├®ines et glucides pour la prise de masse musculaire. Apport calorique ├®lev├® pour les athl├¿tes en phase de construction.,kilogramme,2,80,Multiples: Cola|Watermelon|Orange|Tropical (selon batch),Recharge glycog├¿ne RAPIDE maltodextrine dextrose ultra-absorption imm├®diate|Endurance prolong├®e waxy maize amylopectine ├®nergie soutenue effort long|├ënergie intra-training carbs boost intensit├® haute pendant s├®ance|Recovery post-workout glycog├¿ne r├®pletion optimization musculaire|Min├®raux ├®lectrolytes sodium potassium calcium magn├®sium r├®gulation hydro + crampes pr├®vention|Absorption rapide glucose-sodium cotransport SGLT maximale bioavailabilit├®,"AUCUN allerg├¿ne majeur (pas prot├®ine laiti├¿re ┼ôuf arachide crustac├®). Traces possibles: GLUTEN (atelier), SOJA (possible), ARRACHIDES (├®quipement partag├®). .",,"PR├ë-TRAINING: 25-50g (1-2 doses) 30-60min avant (30-100 kcal boost ├®nergie), INTRA-TRAINING: 25-50g (1-2 doses) m├®lang├®e 400-500ml eau anytime pendant (├®nergie soutenue), POST-WORKOUT: 25-50g (1-2 doses) imm├®diatement apr├¿s (glycog├¿ne r├®pletion priority), FLEXIBLE: 25g standard dose (100 kcal) an...",240,130,185,,100,false,Carb Loader - 2kg | Yava Labs | Dodo Nutrition,Carb Loader - 2kg de Yava Labs est un gainer riche en prot├®ines et glucides pour la prise de masse musculaire. Livraison rapide en Tunisie.
